{
  "id": "q_cb0004",
  "standard_code": "5.C.6",
  "standard_essential": true,
  "reporting_category": "Civics and Government",
  "domain": "Civics",
  "question_type": "multi_select",
  "stimulus": {
    "type": "text",
    "content": "A class is studying the Bill of Rights. The teacher asks students to list freedoms that the First Amendment protects."
  },
  "stem": "Which TWO freedoms are protected by the First Amendment?",
  "choices": [
    {
      "id": "A",
      "text": "Freedom of religion",
      "correct": true
    },
    {
      "id": "B",
      "text": "Freedom to own land",
      "correct": false
    },
    {
      "id": "C",
      "text": "Freedom of the press",
      "correct": true
    },
    {
      "id": "D",
      "text": "Freedom to drive a car",
      "correct": false
    }
  ],
  "answer_explanation": "The First Amendment protects freedom of religion and freedom of the press, along with speech, assembly, and petition. Owning land and driving a car are not rights listed in the First Amendment.",
  "difficulty": "medium",
  "tags": [
    "bill-of-rights",
    "first-amendment",
    "multi-select"
  ],
  "generated_at": "2026-04-13T12:13:00Z"
}